"SCOPUS_ID","EID","Title","Authors","Author IDs","Author Affiliations","Creators","Publication Name","eISSN","Volume","Page Range","Cover Date","DOI","Cited By Count","Aggregation Type","Subtype","Subtype Description","Source ID","Open Access","URL","Abstract","Subject Classification","Affiliation Names","Affiliation Cities","Affiliation Countries"
"105002449159","2-s2.0-105002449159","ADVANCEMENTS AND INTEGRATION OF BIOPHYSICAL, SOCIO-ECONOMIC, AND LOCAL KNOWLEDGE IN AGRICULTURAL LAND SUITABILITY ASSESSMENTS: A SYSTEMATIC LITERATURE REVIEW","Abdullah N., Zolkafli A., Omar M.","57225357295, 57194056520, 36608821700","60002763, 60002763, 60002763","Abdullah N.","Mesopotamia Journal of Agriculture","22249796","53","168-192","2025-03-01","10.33899/mja.2025.156944.1531","0","Journal","ar","Article","21101185947","0","https://api.elsevier.com/content/abstract/scopus_id/105002449159","Land suitability assessments are pivotal for sustainable land use planning, agricultural productivity, and environmental management. Despite substantial advancements, a comprehensive understanding of methodologies, applications, and sustainability challenges across diverse contexts remains limited. This systematic literature review aims to address these gaps by examining advancements, regional practices, and adaptation strategies in land suitability assessments. Using the PRISMA framework, an advanced search of Scopus and Web of Science databases identified 34 eligible studies (n = 34) for analysis. These studies were categorized into three key themes: (1) advancements in methodologies, including GIS-based multi-criteria decision-making (MCDM), machine learning, and hybrid models; (2) applications of land suitability for specific crops and regions, highlighting varying ecological and socio-economic factors influencing implementation; and (3) sustainability and adaptation in land use planning, focusing on the integration of climate resilience and resource conservation. Results indicate that GIS-MCDM approaches dominate, representing 65% of the studies, with machine learning and hybrid methods contributing 20% and 15%, respectively. The review underscores the increasing role of advanced technologies such as remote sensing and IoT in improving precision, yet challenges persist in parameter selection, data quality, and integrating socio-environmental dimensions. This review concludes that while progress in methodologies and applications is evident, future efforts must emphasize sustainability and adaptive strategies to address evolving land use challenges. The findings provide critical insights for researchers and policymakers to enhance land suitability assessments and promote sustainable development practices.","Agricultural and Biological Sciences (miscellaneous), Animal Science and Zoology, Aquatic Science, Plant Science","Universiti Utara Malaysia","Sintok","Malaysia"
"105001864684","2-s2.0-105001864684","Sources of cigarettes for youth smokers in Malaysia: Findings from the National Health and Morbidity Survey (NHMS) 2022: Adolescents Health Survey (AHS)","Lim K.H., Cheong Y.L., Lim K.K., Lim J.H., Hamid H.A.A., Riyadzi M.R., Ghazali S.M., Kee C.C., Kang C.Y., Hui C.S., Marine A.A., Hashim M.H.M., Lim H.L.","33467692800, 55939438800, 56767433800, 57210419351, 57929576000, 57823020300, 51863500600, 26534304800, 57211375931, 59560085300, 58891678100, 57225199448, 57188741881","60030599, 60030599, 60282097, 60104614, 60282097, 60282097, 60030599, 60282097, 60002763, 60216840, 60030599, 60030599, 60282097","Lim K.H.","Tobacco Induced Diseases","16179625","23","N/A","2025-03-01","10.18332/tid/201987","0","Journal","ar","Article","19700166506","0","https://api.elsevier.com/content/abstract/scopus_id/105001864684","INTRODUCTION Developing effective intervention programs to lower adolescent smoking requires a thorough understanding of the sources and methods of youth tobacco product acquisition. This study aimed to identify the sources of cigarettes and related variables among adolescent smokers in Malaysian schools using the latest national data from the National Health and Morbidity Survey: Adolescents Health (NHMS: AHS) 2022. METHODS We conducted the NHMS 2022: AHS to obtain a representative sample of school-age teenagers via a cross-sectional study design and a multi-stage sampling approach. We selected 1934 school-going adolescents aged 13–17 years who have smoked at least once in the previous 30 days from a total of 33523 respondents in the study. Data were collected from the participants using a pre-validated self-administered questionnaire. The analysis involved calculating adjusted odds ratios (AORs) with 95% confidence intervals (95% CIs). Furthermore, we examined potential two-way interactions between the independent variables. RESULTS The study found that 6.2% (95% CI: 5.9–6.6) of teenagers in schools are currently smoking, with a notably higher percentage of male to female current smokers (10.8% vs 1.6%). Approximately 23.1% of current smokers are frequent smokers. Almost three-quarters of current smokers obtained their cigarettes from fixed premises (38.9%), and that friends (34.9%) were the primary sources of cigarettes among adolescents. The data show that more than half (59.7%, 95% CI: 57.0–62.4) of current smokers obtained cigarettes from commercial sources. CONCLUSIONS The study found that a notably more significant proportion of adolescent smokers obtained their cigarettes from commercial vendors compared to their friends. These finding implies that increased law enforcement and health promotion programs are needed to lower the incidence of adolescent smoking in Malaysia.","Health (social science), Medicine (miscellaneous), Public Health, Environmental and Occupational Health","Institute for Medical Research","Shah Alam","Malaysia"
"105001525608","2-s2.0-105001525608","Creating a Sustainable Tourism Business Model for Small-scale Tourism Products in Malaysia: Embracing Tourism Opportunity for Post-pandemic Resilience","Wafi A.A., Mohamed S., Hanapi Z., Ibrahim J.A., Samsudin N.","57810372700, 57200867490, 56499161200, 57388400300, 56559920800","60103633; 60103633, 60103633; 60103633, 60103633; 60103633, 60002763, ","Wafi A.A.","Pertanika Journal of Social Sciences and Humanities","22318534","33","29-49","2025-03-01","10.47836/pjssh.33.1.02","0","Journal","ar","Article","19600162021","0","https://api.elsevier.com/content/abstract/scopus_id/105001525608","The tourism business is battling to survive in 2019 due to travel restrictions, border closures, and the closure of most services. The pandemic is having a more severe impact on small-scale tourism products than on others. Therefore, it is urgent to introduce new elements into business models to assist these operators in maintaining operations and sustaining their products. Given that most revenue in the tourism industry comes from small-scale products that directly benefit local communities, tourism operators need to identify the key elements of their business model. The current nine elements of the small-scale business model are the customer segments, value proposition, revenue streams, channels, customer relationships, key activities, key resources, key partners, and cost structure. However, these small-scale tourism operators must add new components to their business strategies for product sustainability to remain competitive today. Hence, the goals of this study were addressed by using the qualitative technique as the research design. Ten informants, including tourism representatives and operators from Johor, Kedah, and Negeri Sembilan, participated in this semi-structured interview. Using NVivo, data were coded, translated as necessary, and transcribed. The content was analysed according to thematic analysis. The new main components of the business model are professional guidance, facilities, travel experience, information delivery, stakeholder collaboration, product management and risk management to guarantee the viability and resilience of small-scale tourism operators. These new findings can assist tourism operators in sustaining their products.","Business, Management and Accounting (all), Arts and Humanities (all), Social Sciences (all), Economics, Econometrics and Finance (all)","Universiti Pendidikan Sultan Idris","Tanjong Malim","Malaysia"
"105001523345","2-s2.0-105001523345","Travel Bubble in Langkawi: Insights from Hotel Managers of Muslim-friendly Budget Hotels","Yusof N.A.M., Ahmad R., Ramely A., Shariff N.M., Soelar S.A.","57479310100, 55855797300, 57211673055, 47762272700, 55570630900","60002763, 60002763, 60002763, 60002763, 106383710","Yusof N.A.M.","Pertanika Journal of Social Sciences and Humanities","22318534","33","427-442","2025-03-01","10.47836/pjssh.33.1.19","0","Journal","ar","Article","19600162021","0","https://api.elsevier.com/content/abstract/scopus_id/105001523345","With the advent of the COVID-19 pandemic, stringent restrictions were imposed on tourism activities worldwide to curb the virus’ spread, resulting in disastrous consequences for the tourism sector. The Travel Bubble program was introduced in selected destinations in response to this crisis. Langkawi Island in Malaysia was chosen as the pilot location for the Travel Bubble initiative, beginning September 16, 2021. This study aims to investigate the impact of the Travel Bubble on Muslim-friendly budget hotels, both during its implementation and 18 months after its inception. This study employs a qualitative approach that entailed semi-structured interviews with seven managers of Muslim-friendly budget hotels. The findings demonstrate that while the Travel Bubble program initially boosted optimism by rejuvenating the tourism industry, it later became clear that the hotels did not equally reap its benefits. For the initial phase, only one theme emerged: Travel Bubble provides short-term benefits. Eighteen months after its launch, three themes were recognised: Langkawi is expensive, business-minded financial management, strategic location and loyal customers. From the findings, understanding and catering to customer needs and preferences is crucial for sustained success. Besides that, Langkawi must engage in sustainable innovations, which entails recognising and leveraging distinctive features to stand out in the market and sustain its competitiveness. Further, often addressing complex challenges requires collaboration and partnership among stakeholders. This study offers several practical implications for the operators of Muslim-friendly budget hotels, such as the importance of agility (adaptability to changing circumstances), resilience (resilience in the face of challenges) and customer focus (attentive to the needs and preferences of guests).","Business, Management and Accounting (all), Arts and Humanities (all), Social Sciences (all), Economics, Econometrics and Finance (all)","Universiti Utara Malaysia","Sintok","Malaysia"
"105001474563","2-s2.0-105001474563","Entrepreneurial university input, core strategic plan and output: research on undergraduates entrepreneurial behaviour and career","Murad M., Othman S., Kamarudin M.A.I.","57822559400, 57217864026, 57425138900","60002763, 127914182, 60002763","Murad M.","Entrepreneurship Education","25208152","8","99-129","2025-03-01","10.1007/s41959-025-00137-w","1","Journal","ar","Article","21101238109","0","https://api.elsevier.com/content/abstract/scopus_id/105001474563","The research investigates the impact of entrepreneurial university input (EUI), entrepreneurial university core strategic plan (EUCSP) and entrepreneurial university output (EUO) on student entrepreneurial behaviour (SEB) and student entrepreneurial career (SEC). A useful sample of 185 respondents was collected from undergraduates registered in twelve business incubators of universities. RStudio was used to determine the findings of covariance based—structural equation model (CB-SEM). The study found EUI has no impact on SEB and SEC. Secondly, the study revealed that EUCSP has a significant impact on SEB and SEC. Thirdly, the study found that EUO has a significant impact on SEB and SEC. The findings of this research contribute the impact of EUI, EUCSP and EUO in SEB and SEC. The study also has methodological robustness which is based on R programming. Furthermore, this study recommends significant policy implications and practical recommendations that can be used by the top governing and monitoring body of universities in Pakistan and other developing countries.","Economics, Econometrics and Finance (miscellaneous), Business, Management and Accounting (miscellaneous), Education, Social Sciences (miscellaneous)","Universiti Utara Malaysia","Sintok","Malaysia"
"105001449210","2-s2.0-105001449210","The Effect of Coaching Leadership On Employee Well-Being, Knowledge Sharing, And Employee Innovative Behavior","Tanuwijaya J., Batmomolin A.M.D., Shadi J., Ratnasari A., Batmomolin A., Wan Abdul Halim W.F.S.","57960473300, 57925598300, 59715831100, 59715251100, 57218685304, 57296093400","60069400, 60069400, 60069400, 60069400, 127135676, 60002763","Tanuwijaya J.","Quality - Access to Success","N/A","26","235-244","2025-03-01","10.47750/QAS/26.205.24","0","Journal","ar","Article","17700156709","0","https://api.elsevier.com/content/abstract/scopus_id/105001449210","Rapid changes and strict competition in the business world require relevant leadership strategies. Coaching leadership has advantages compared to other leadership styles that have been widely studied because coaching leadership emphasizes the personal approach and uniqueness of employees. This quantitative study aims to examine the effect of coaching leadership on employee well-being, knowledge sharing, and employee innovative behavior. Distributing questionnaires to 175 bank employees in Jakarta, Indonesia using a google form. The collected data was processed and analyzed using Structural Equation Modeling (SEM) with SmartPLS software. The research findings prove that coaching leadership has a positive direct and indirect effect on employee wellbeing, knowledge sharing behavior, and employee innovative behavior. The leader's personal approach influences the positive behavior of employees and encourages employees to behave and work according to the expectations of the organization. Therefore, leaders and managers need to develop coaching leadership as a strategy to increase organizational excellence and competitiveness.","Management Information Systems, Business and International Management, Strategy and Management","Universitas Trisakti","Jakarta","Indonesia"
"105001305852","2-s2.0-105001305852","Driving SME Growth Through Digital Leadership: Exploring Tenure and Transformation Dynamics","Imran M., Hamid R.A., Haque A.U.","57208560582, 59714993100, 57055032900","60002763, 60002763, 124735175","Imran M.","Administrative Sciences","20763387","15","N/A","2025-03-01","10.3390/admsci15030104","0","Journal","ar","Article","21101043277","1","https://api.elsevier.com/content/abstract/scopus_id/105001305852","The main objective of this study is to investigate the role of digital leadership in the sustainability of SMEs. Furthermore, this study examines the mediating role of digital transformation between digital leadership and SME sustainability and the moderating role of leadership tenure on the relationship between digital leadership and digital transformation. This research provides a unique perspective by exploring these connections within the context of developing countries by considering Malaysia as a case study. We employed the structural equation modeling (SEM) technique to analyze the 368 respondents’ data. The study results found a positive relationship between digital leadership and SMEs’ sustainability. Furthermore, it also revealed the positive and significant mediating role of digital transformation between digital leadership and SME sustainability. Examining mediating and moderating factors provided valuable insights for SMEs and policymakers alike. Research findings contribute to both theoretical understanding and practical applications.","Business, Management and Accounting (all)","Universiti Utara Malaysia","Sintok","Malaysia"
"105000914171","2-s2.0-105000914171","DEVELOPING PERSONAL FINANCES HEALTH MEASUREMENT INDEX AND CALCULATOR FOR YOUNG ADULTS BASED ON FINANCIAL AND EMOTIONAL ASPECTS","Muhamad N., Misiran M., Sapiri H., Yusof Z.M., Mahat N.I., Shamsudin Z.A.","59525154200, 36682863400, 55534807700, 59897471500, 18434434800, 57225950469","60002763, 60002763, 60002763, 60002763, 60002763, 60002763","Muhamad N.","Journal of Quality Measurement and Analysis","26008602","21","287-305","2025-03-01","10.17576/jqma.2101.2025.18","0","Journal","ar","Article","21101243618","0","https://api.elsevier.com/content/abstract/scopus_id/105000914171","Measurement of healthy personal finances is mostly centered on the tangible assets and liabilities assessments, without considering of the emotional aspects that may lead young adults to save (or spend) money based on impulses and other emotional driving factors. This study aims to develop a measurement index to form a personal finances scorecard and calculator that can provide assessment on financial performance among young adults, from the tangible and emotional aspects. The balanced scorecard introduced by Kaplan and Norton (1992) and Yang et al. (2010) will be extended into a proposed personal financial balanced scorecard (PFBSC) to achieve the objective. A financial measurement quadrant is constructed with color-coded scorecard to improve visualization and give better understanding of the result. The findings suggest that the developed scorecard and calculator is easy to use, suitable for young adults, and able to capture both the tangible and emotional aspects of personal finances indicators.","Economics and Econometrics","Universiti Utara Malaysia","Sintok","Malaysia"
"105001067167","2-s2.0-105001067167","Determinants of SMEs’ performance: amalgamation of entrepreneurial, market and brand orientations","Ismail A.R., Mohamad B.","57211954080, 25960913300","60212346, 60212346","Ismail A.R.","International Journal of Entrepreneurial Behaviour and Research","N/A","31","531-562","2025-02-25","10.1108/IJEBR-02-2022-0167","9","Journal","ar","Article","144744","0","https://api.elsevier.com/content/abstract/scopus_id/105001067167","Purpose: Scholars and practitioners alike are paying attention to entrepreneurial orientation (EO) as an antecedent of the financial performance of SMEs. Other factors foster and improve SMEs' financial performance. This paper aims to shed the light on other two different strategic orientations that may help enhance SMEs' financial performance in addition to EO, namely; market orientation (MO) and brand orientation (BO). Design/methodology/approach: The three different important strategic orientations are explored through two different studies. The first study was conducted to determine the different effects of the three orientations on SMEs' financial performance. Data were collected using a questionnaire among a convenient sample (131) of business owners/managers, and next PLS-SEM was used for data analysis. The financial performance of firms in the second study is hypothesized to be an outcome of a combination of different strategic orientations; therefore, the fsQCA method is applied to explore the causal recipes of those orientations. Findings: The paper concluded that the three different strategic orientations are collectively, of paramount importance to strategic managers of SMEs. Originality/value: The brand, market and EOs have been discussed discretely in previous studies and this study attempted to provide managers/owners of SMEs with a holistic view of the three different orientations and the amalgamation among them to be beneficial for better financial performance.","Business and International Management, Business, Management and Accounting (miscellaneous)","Othman Yeop Abdullah Graduate School of Business","Kuala Lumpur","Malaysia"
"85173750306","2-s2.0-85173750306","New demands by hotel customers post COVID-19 era","Al-Kumaim N.H.S., Samer M., Hassan S.H., Shabbir M.S., Mohammed F., Al-Shami S.","57222221690, 58639917900, 36131385500, 57188818896, 57202238579, 58110130000","60078086, 60078086, 60000906, 60196596, 60002763, 60078086","Al-Kumaim N.H.S.","Foresight","14659832","27","1-28","2025-02-21","10.1108/FS-05-2023-0082","1","Journal","ar","Article","16106","0","https://api.elsevier.com/content/abstract/scopus_id/85173750306","Purpose: The purpose of this study is to understand the situation of hotels and tourism industry in Malaysia during and in post Covid-19 and to mitigate indirect damage caused by COVID-19 to the hotel business and tourism industry by examining the factors that have an influence on hotel’s customer satisfaction rating and revisit intention through an integration of service quality (SERVQUAL) framework and expectation-confirmation theory (ECT). Design/methodology/approach: The SERVQUAL and ECT were considered the underpinning theoretical models but are integrated and extended by including a few additional variables. Data were collected from 458 respondents of travelers and hotel customers in Malaysia and analysed by applying partial least squares structural equation model technique. Findings: The empirical results established that significant positive relationships exist between the three newly emerged independent variables (IVs), namely, hygienic practice, greenness of service and digitalization and hotel customer satisfaction towards hotel revisit intention, and only two variables from SERVQUAL, namely, reliability and assurance, have a significant relationship with hotel customer satisfaction towards hotel revisit intention. The results reveal that customer satisfaction has significant direct effect between above-mentioned IVs and customers revisit intention. Research limitations/implications: The use of purposeful sampling method in only one country might limit the generalizability of the results. Future research should be planned to duplicate the current study using a sizable sample of participants from multiple countries and include other related factors related to the pandemic phenomena such as safety, hotel location and health value offered. Practical implications: Theoretical findings imply that service quality is a dynamic theory that should be examined continuously to achieve sustainable and resilient performance in today’s competitive business environment, as some modifications inevitably occur over time and new factors could be emerged. Regarding practical implications, study findings proved the great significance of assurance, reliability, digitalization, greenness and hygienic practices on customer satisfaction towards intention to revisit to hotel. Therefore, it is critical for hotel management to retain hotel business industry in a way that fits and matches customer’s health protection, meets customer’s newly prompted expectations and needs and ensures resilience during unsettled times. Originality/value: This study is unique as the newly emerged variables are included in the research framework, and thus it helps to close the literature gap by introducing an integrated SERVQUAL and ECT theoretical model, which rarely performs in this context and can be replicated or extended with validated scales. This study contributes to enhancing hotel and tourism sustainable service quality performance to achieve myriad economic and health values.","Economics, Econometrics and Finance (all), Management Science and Operations Research","Universiti Teknikal Malaysia Melaka","Malacca","Malaysia"
