"SCOPUS_ID","EID","Title","Authors","Author IDs","Author Affiliations","Creators","Publication Name","eISSN","Volume","Page Range","Cover Date","DOI","Cited By Count","Aggregation Type","Subtype","Subtype Description","Source ID","Open Access","URL","Abstract","Subject Classification","Affiliation Names","Affiliation Cities","Affiliation Countries"
"86000761448","2-s2.0-86000761448","Study on cultural inheritance and innovation in rural tourism enabled by university student volunteer participation","Siqi C., Saidon M.K., Kassim N.F.","59680902100, 57203134540, 59649663000","60002763; 60073499, 60002763, 60002763","Siqi C.","Environment and Social Psychology","24248975","10","N/A","2025-01-01","10.59429/esp.v10i1.3367","0","Journal","ar","Article","21101117183","1","https://api.elsevier.com/content/abstract/scopus_id/86000761448","Rural tourism is the embodiment of the combination of rural industry revitalization and cultural revitalization. As an important part of the conformal development of rural tourism, cultural inheritance and innovation are also facing challenges in the aspects of talent inheritance, publicity methods and content innovation. University student volunteers are as cultural inheritors, educators and innovators of rural tourism. And cultural volunteer activities also promote students in psychology level. Through an in-depth discussion on the cultural inheritance and innovation of university student volunteer participation in rural tourism, this study states that although university student volunteer participation has brought fresh vitality and innovative thinking to the cultural inheritance and innovation of rural tourism, it also faces challenges such as imperfect team building mechanism, incorrect targeted service content, single activity form, lack of in-depth thinking of tourism resources, and insufficient integration with rural revitalization. In response to these challenges, this study proposes to strengthen the institutional construction, diversification construction, depth construction and brand construction of university student volunteer participation for rural cultural tourism, so as to consolidate the cultural foundation of high-quality development of rural tourism and promote the integration of rural culture and tourism as an important force for rural revitalization.","Social Psychology, Health (social science), Neuropsychology and Physiological Psychology, Developmental and Educational Psychology","Hanshan Normal University | Universiti Utara Malaysia","Chaozhou | Sintok","China | Malaysia"
"86000754976","2-s2.0-86000754976","Generalized Bayesian Double Group Sampling Plan for Manufacturing Industry","Hafeez W., Aziz N., Abid M., Abbas Z., Imran M.","57213198616, 55670543800, 57211183843, 56352223900, 57440614700","60017482, 60002763; 60002763, 60070615, 60021200, 60025345","Hafeez W.","Pakistan Journal of Statistics and Operation Research","22205810","21","71-82","2025-01-01","10.18187/pjsor.v21i1.4722","0","Journal","ar","Article","21100200822","0","https://api.elsevier.com/content/abstract/scopus_id/86000754976","Quality is not simply a goal or a choice for organizations, it is also a need for success in the global market. Acceptance sampling is one of two key strategies for quality assurance in manufacturing industry, along with statistical process control. After inspection the lot is either accepted or rejected based on the acceptance criteria. If historical information about the product is available, then the most effective approach for making the appropriate judgement is the Bayesian approach. To estimate quality regions, this work presents a Bayesian double group sampling plan (BDGSP). Based on acceptance criteria, the binomial distribution is used to build a likelihood function for defective and non-defective items. The beta distribution is utilized as the prior distribution to determine the average probability of acceptance. For some stated values of producer’s and consumer’s risks, four different quality regions are estimated. The suggested plan estimates variation point values based on various design parameter combinations. Producer’s and consumer’s risks correlate with acceptable quality levels and limiting quality levels of regions, respectively. Operating characteristic curves are used to monitor the effects of change in the values of specified parameters and for comparison with existing sampling plan. Application based on real data set proves that the proposed plan is applicable for existing manufacturing industry policies.","Statistics and Probability, Modeling and Simulation, Statistics, Probability and Uncertainty, Management Science and Operations Research","Jiangsu University","Zhenjiang","China"
"86000652498","2-s2.0-86000652498","DARCY–FORCHHEIMER RADIATIVE FLOW OF A HYBRID NANOFLUID WITH VELOCITY MASS FLUX AND THERMAL STABILITY","Asghar A., Hanafy H., Fadhel M.A., Lund L.A., Khan S.U., Tlili I.","57226881230, 6701752122, 57962553100, 57207795214, 56704024900, 15842369800","60002763, 60110525; 60218492, 60109276, 60062370, 60166770, 60105081","Asghar A.","Journal of Porous Media","19340508","28","71-87","2025-01-01","10.1615/JPorMedia.2024051851","3","Journal","ar","Article","21183","0","https://api.elsevier.com/content/abstract/scopus_id/86000652498","This research aimed to predicts the stability of hybrid nanofluid subject to the contribution of the Darcy–Forchheimer flow. The thermal feature of the current model was exposed by encountering thermal radiative consequences. The combination of aluminum oxide and copper tiny materials were collectively decomposed with water liquid, which expressed the base material. The addition of thermal phenomenon occurred by using convective thermal constraints. Multiple numerical simulations supported with the shooting technique were performed. The dual solution was deduced for a governing problem for flow parameters. Additionally, a stability analysis was worked through for the given model. Upon enhancing the nanoparticles volume fraction, the boosted heat transfer phenomenon was observed. The Nusselt number reduced in dual branches due to nanoparticles volume fraction.","Modeling and Simulation, Biomedical Engineering, Materials Science (all), Condensed Matter Physics, Mechanics of Materials, Mechanical Engineering","Universiti Utara Malaysia","Sintok","Malaysia"
"86000628696","2-s2.0-86000628696","Government support and SMEs' dimensional performance during the COVID-19 crises: Does disruption orientation matter?","Mahmoud M.A., Mahmoud A.","56489697100, 57347431200","60002763, 60025909","Mahmoud M.A.","International Journal of Productivity and Performance Management","N/A","N/A","N/A","2025-01-01","10.1108/IJPPM-03-2024-0187","0","Journal","ar","Article","145293","0","https://api.elsevier.com/content/abstract/scopus_id/86000628696","Purpose: This study is aimed at scrutinizing the moderating influence of disruption orientation (DO) on the nexus between government support (GS) and the multidimensional performance of small and medium-sized enterprises (SMEs) through the COVID-19 turbulence. Design/methodology/approach: A cross-sectional survey design was engaged for data collection using structured hand-delivered questionnaires. Partial least square structural equation modeling was used to test the hypothesized relationships based on a sample response of 170 SMEs from Kano, Nigeria. Findings: GS has no direct impact on both financial performance (FP) and non-financial performance (NFP) of SMEs in Nigeria during the COVID-19 crisis. However, DO demonstrates a constructive direct significant influence on the SMEs’ FP and NFP. Additionally, DO positively moderates the relationship between GS and the FP and NFP. Practical implications: The findings implied that GS could not solitarily make an impact on SMEs’ FP and NFP during crises. Nevertheless, DO is imperative in revitalizing the impact of GS on both performance dimensions of SMEs during disruptions. Consequently, policymakers should consider DO as a precondition for SMEs access to GS, if SMEs performance is the target for improvement. Originality/value: The research model is the first to integrate and empirically validate the moderating effect of DO on the GS and SME performance relationships during crises. The study particularly highlights the role of DO in SMEs during crises and the limited role of GS. This study, therefore, contributes theoretically to the disruption management and GS literature for SMEs.","Business, Management and Accounting (all), Strategy and Management","Universiti Utara Malaysia","Sintok","Malaysia"
"86000609688","2-s2.0-86000609688","Lean and Agile Principles as Mediators in the Link between Inventory Management Practices and Sustainable Humanitarian Medical Supply Chain Management in Qatar","Alkhdour R.Y., Mohammad N., Ahmad Mahyadin F.","59677546300, 59676608100, 59676421700","60212344; 60072743, 60212344, 60212344","Alkhdour R.Y.","Paper Asia","N/A","41","106-122","2025-01-01","10.59953/paperasia.v41i1b.368","0","Trade Journal","ar","Article","56171","1","https://api.elsevier.com/content/abstract/scopus_id/86000609688","This study examines the mediating role of Lean and Agile principles in the relationship between inventory management practices (IMPs) and Sustainable Humanitarian Medical Supply Chain Management (SHMSCM) in Qatari hospitals. A total of 250 logistics managers and procurement officers from 16 public hospitals and 304 private hospitals, including health centers, participated in the survey, which utilized structured questionnaires. Data was analyzed using Smart PLS 4.0, revealing that the integration of Lean and Agile principles into IMPs significantly enhances efficiency and sustainability. Key improvements include waste reduction, increased flexibility to meet fluctuating demands, and optimized resource management. Path coefficient analysis demonstrated strong positive relationships, indicating that adopting Lean and Agile methodologies can substantially improve supply chain efficiency. Contrary to initial expectations, Supplier Relationship Management (SRM) did not exhibit a significant correlation with Lean and Agile principles or SHMSCM, suggesting the need for further investigation in this area. The model’s explanatory power, reflected in R² and adjusted R² values, was notably high, with the independent variables accounting for 89% of the variance in sustainability outcomes. These findings underscore the critical implications for healthcare administrators and policymakers, emphasizing the importance of Lean and Agile principles in inventory management to reduce costs and enhance healthcare quality. Future research should explore additional mediating mechanisms, longitudinal impacts, and the integration of emerging technologies to provide a more comprehensive understanding of sustainable supply chain management in the healthcare sector.","Materials Science (all), Media Technology, Marketing","College of Business, Universiti Utara Malaysia | Hamad Medical Corporation","Sintok | Doha","Malaysia | Qatar"
"86000591575","2-s2.0-86000591575","A study on the visual design satisfaction of cultural creative products on the basis of perceived value: A case study of the tianjin binhai art museum","Ismail A.I.B., Liu P., Mingming H.","42861368200, 59678251400, 59678392500","60002763, 60002763; 60261071, 60261071","Ismail A.I.B.","Multidisciplinary Science Journal","26751240","7","N/A","2025-01-01","10.31893/multiscience.2025374","0","Journal","ar","Article","21101133576","0","https://api.elsevier.com/content/abstract/scopus_id/86000591575","Taking the Tianjin Binhai Art Museum in China as a case study, this research adopts wetland observation and questionnaire survey methods to explore the relationship between the perceived value of cultural creative product visual design and consumer satisfaction. The study revealed that the functional value, experiential value, and cognitive value of the visual design of the Tianjin Binhai Art Museum’s cultural creative products have positive effects on consumer satisfaction, with the lowest satisfaction score found for experiential value. This investigation also underscores the significance of visual typesetting components, such as aesthetic charm, societal images, and interactivity, can impact the overall observation of an product. By inspecting the interplay between these aspects, this analysis emphasizes that shoppers’ emotional and cerebral participation is as critical as the operational worth of the goods. The analysis puts forward an comprehensive paradigm that consolidates shows, cultural items, and art teaching plans to improve the demonstration and distribution of cultural resourceful merchandise. This research remarkably highlights how visual elements like appealing appearance, cultural signs, and interactivity can affect overall perception. By examining the interplay between visual style factors, consumers' emotional and intellectual involvement, and functional value, the study proposes an integrated model of exhibitions, cultural products and programs to enhance presentations and spread of cultural creative works. The research proposes a model that combines exhibitions, cultural creative products, and art education programs to enrich the presentation and dissemination of cultural creative products while emphasizing the enhancement of functional and cognitive values, as well as focusing on interactivity and consumer experience.","Multidisciplinary","Universiti Utara Malaysia","Sintok","Malaysia"
"86000570088","2-s2.0-86000570088","The Landscape of Research on Mobile Learning Material: Coherent Taxonomy, Motivation, Challenges and Recommendations","Miaomiao X., Abdul Mutalib A., Hamzah H.I.","59677329200, 14032249200, 35776656100","60002763, 60002763, 60002763","Miaomiao X.","Paper Asia","N/A","41","195-208","2025-01-01","10.59953/paperasia.v41i1b.394","0","Trade Journal","ar","Article","56171","1","https://api.elsevier.com/content/abstract/scopus_id/86000570088","The primary objective of this study is to establish a systematic research framework for Mobile Learning Material (MLM) to address the existing fragmentation and lack of categorization in the current body of knowledge. In contrast to previous studies that predominantly focused on isolated applications of MLM, this study conducts a comprehensive review of the existing literature, classifying MLM research into multiple categories and proposing a clear taxonomy. This holistic and systematic approach fills a critical gap in the current research landscape and provides educators and policymakers with a clear reference framework for promoting effective implementations of MLM in educational practice. Previous studies were searched through the Scopus, Web of Science, and ScienceDirect databases. The reason for this choice is that those databases cover both learning and technical literature. In the end, 66 articles were selected. Most of the articles are survey articles (63/66), referring to practical learning material literature or mobile devices to describe the style of performance, specific subjects, and purposes of MLMs. In some cases, a comprehensive assessment of new trends was carried out. Most of the papers cover various studies (30/63), ranging from exploring MLMs that have new functions in the development of designs to seeking to evaluate the MLM. A considerable number of researchers (25/63) are just evaluating the existing MLM. A small part of studies (8/63) goes along the new wave, introducing their practical attempts to develop MLM or sharing their development experiences. Besides, the smallest part of the article is only (3/66) which provides an overview of MLM.","Materials Science (all), Media Technology, Marketing","Universiti Utara Malaysia","Sintok","Malaysia"
"86000528793","2-s2.0-86000528793","Human-AI Collaborative Feedback in Improving EFL Writing Performance: An Analysis Based on Natural Language Processing Technology","Bai X., Nordin N.R.M.","59677797500, 57216464045","60002763, 60002763","Bai X.","Eurasian Journal of Applied Linguistics","21491135","11","1-19","2025-01-01","10.32601/ejal.11101","1","Journal","ar","Article","21100896854","0","https://api.elsevier.com/content/abstract/scopus_id/86000528793","A perfect writing skill has been deemed instrumental to achieving competence in EFL, yet it is considered one of the most impressive learning domains. This study investigates the impact of human-AI collaborative feedback on the writing proficiency of EFL students. It examines key teaching domains, including the teaching environment, teacher knowledge and experience, and feedback quality and timeliness, focusing on language features such as accuracy, complexity, and fluency. This study employed a mixed-methods approach, integrating both quantitative and qualitative data. A stratified random sampling technique was utilised to select 260 EFL students from tertiary institutions for the survey, while purposive sampling was employed to recruit five participants for semi-structured interviews. Quantitative data were analysed using regression and mediation tests to examine the relationships between feedback and writing performance. In contrast, qualitative data were subjected to thematic analysis to explore participants' perceptions of the human-AI feedback mechanism. The findings indicate that human-AI collaborative feedback significantly enhances writing performance by delivering timely and detailed insights, thereby fostering improvements in language accuracy, complexity, and fluency. Additionally, writing enjoyment and cognitive competencies were identified as mediators in the relationship between feedback and writing improvement. The study highlights the potential of integrating AI into EFL feedback systems to complement existing approaches and foster more comprehensive improvements in EFL writing. The study acknowledges certain limitations, including its reliance on self-reported data, which may introduce biases in students' perceptions of their writing improvement.","Social Psychology, Language and Linguistics, Education, Linguistics and Language","Universiti Utara Malaysia","Sintok","Malaysia"
"86000506736","2-s2.0-86000506736","The Moderating Effect of Regulatory Pressure on the Relationship between Sustainable Supply Chain Practices and Performance: Evidence from Algerian Oil and Gas Companies","Benmebarek A., Hami N., Hashim R.","59676416400, 56790056800, 57217873044","60212344, 60212344, 60212344","Benmebarek A.","Paper Asia","N/A","41","409-423","2025-01-01","10.59953/paperasia.v41i1b.403","0","Trade Journal","ar","Article","56171","1","https://api.elsevier.com/content/abstract/scopus_id/86000506736","Companies prioritizing economic profits often overlook the environmental and social impacts of their activities, creating an imbalance in sustainability that results in pollution and social disruption. Addressing this issue requires balancing economic, ecological, and social sustainability. This study examines the impact of sustainable supply chain management (SSCM) practices on sustainable performance (SP) and investigates the moderating role of regulatory pressure. Based on a sample of 133 senior managers and executives from Algeria's oil and gas sector, the study employs partial least squares Structural Equation Modelling to test the proposed model and hypotheses. The findings demonstrate that SSCM practices significantly enhance the environmental, social, and economic dimensions of sustainable performance, with regulatory pressure playing a critical role. This research offers valuable insights for supply chain scholars, introducing a new subfield focused on pressure-driven SSCM and advancing understanding of the relationship between regulatory pressure, SSCM practices, and sustainability performance in the oil and gas industry.","Materials Science (all), Media Technology, Marketing","College of Business, Universiti Utara Malaysia","Sintok","Malaysia"
"86000439214","2-s2.0-86000439214","Decoding Trust: An Agent-Based Computational Model of User’s Trust Interplay Dynamics in e-Hailing Services","Ab Aziz A., Mahmod M., Abd. Ghani N.F., Jalil E.E.A., Khalid R.K.R.M.","57223118030, 36608608200, 59677513300, 56225882500, 59677513400","60002763, 60002763, 60002763, 60212344, 132347873","Ab Aziz A.","Lecture Notes in Computer Science (including subseries Lecture Notes in Artificial Intelligence and Lecture Notes in Bioinformatics)","16113349","15431 LNAI","15-27","2025-01-01","10.1007/978-981-96-0692-4_2","0","Book Series","cp","Conference Paper","25674","0","https://api.elsevier.com/content/abstract/scopus_id/86000439214","The rise of e-hailing services has transformed urban transportation, offering on-demand rides via mobile apps that outpace traditional taxis and fixed public transport schedules. These services enhance mobility for diverse user needs, optimizing efficiency by matching riders with nearby drivers and reducing urban congestion. Trust becomes one of the critical success factors towards this acceptance. Current trust models often lack empirical validation through practical simulations. This paper addresses this gap by proposing an agent-based computational model to simulate trust dynamics within e-hailing services. Through extensive simulation experiments and mathematical analyses, our model explores the interplay of trust among individual users and communities, aiming to enhance understanding and predict trust behaviours in complex service environments. Future research will focus on developing community-aware analytics to effectively monitor and intervene in trust dynamics.","Theoretical Computer Science, Computer Science (all)","Universiti Utara Malaysia","Sintok","Malaysia"
"86000269169","2-s2.0-86000269169","Identifying the researchable themes in seventh sustainable development goal: affordable and clean energy","Murad M., Othman S.B., Kamarudin M.A.I.B.","57822559400, 57217864026, 57425138900","60002763, 60212346, 60002763","Murad M.","International Journal of Energy Sector Management","N/A","N/A","N/A","2025-01-01","10.1108/IJESM-11-2024-0023","0","Journal","re","Review","6400153116","0","https://api.elsevier.com/content/abstract/scopus_id/86000269169","Purpose: The purpose of this study is to present a bibliometric analysis of affordable and clean energy research, focusing on key themes, collaboration patterns and the field’s intellectual structure. Design/methodology/approach: Using a sample of 37 articles from Scopus, the authors identified the most frequently used keywords, the most productive countries and organizations and categorized research themes into niche, motor, basic and emerging or declining themes. “Clean Energy,” “Renewable Energy” and “Affordable and Clean Energy” emerged as dominant keywords, highlighting the field’s alignment with global sustainability goals. The USA, China and India were found to be the most productive countries, while institutions like Sri Manakula Vinayagar Engineering College and Nigerian National Petroleum Company played pivotal roles in collaborative networks, reflecting a globalized and interdisciplinary research environment. Findings: The thematic analysis revealed that motor themes, such as “Climate Change” and “Greenhouse Gases”, are central to the discourse, while topics like “Economic Development” and “Energy Conservation” were identified as niche areas. Basic themes, including “Carbon Dioxide” and “Electricity Industry,” remain foundational yet underdeveloped. Originality/value: This study provides a structured overview of the affordable and clean energy research landscape, offering insights into current trends and identifying areas for future exploration, with an emphasis on interdisciplinary collaboration and socio-economic impacts.","Energy (all), Strategy and Management","Universiti Utara Malaysia","Sintok","Malaysia"
